{
  "schema_version": "p2a.spec.v1",
  "project_id": "p2a-local-artifact-store",
  "source_intake": "../gate-a-intake/intake.json",
  "product": {
    "problem": "P2A는 계획 문서, task graph, run 기록, proposal, review를 로컬 md/json 파일로 남기지만, 파일만으로는 project, iteration, task, run, document 사이의 관계형 조회와 검색, 향후 RAG/회고 기반 자기고도화 준비가 어렵다. 이 서버는 로컬 파일을 원본으로 유지하면서 산출물을 동기화하고 검색하기 위한 보조 저장소를 제공한다.",
    "target_users": [
      "로컬에서 P2A CLI/GUI를 사용하는 단일 개발자",
      "향후 P2A GUI 또는 CLI 동기화 기능",
      "P2A run과 planning artifact를 회고하거나 검색하려는 운영자"
    ],
    "goals": [
      "project, iteration, task, run, document 관계를 보존한다.",
      "각 artifact에 canonical server ID와 version lineage를 부여하고, 로컬/P2A ID는 source reference로 보존한다.",
      "P2A GUI/CLI가 git client처럼 local artifact working tree와 server canonical store를 동기화할 수 있는 저장/조회 기반을 제공한다.",
      "문서 스냅샷, task graph, task, run, chunk를 REST API로 저장한다.",
      "content hash 기반으로 중복 저장을 방지하고 idempotent sync를 지원한다.",
      "canonical projectId, iterationId, taskId, runId와 source*Id, artifactType, sourcePath 기준 조회를 제공한다.",
      "RAG/회고용 이전 이력 조회를 위해 deterministic lexical retrieval인 keyword 검색과 pgvector 기반 vector 검색 준비를 제공한다.",
      "저장소와 검색 backend를 port/adapter 경계로 분리해 pgvector에서 OpenSearch/Elasticsearch 같은 후속 검색 adapter로 확장할 수 있게 한다.",
      "embedding은 외부에서 주입된 값을 저장하고 서버 내부에서 AI API를 호출하지 않는다.",
      "Docker Compose와 Testcontainers 기반 로컬 개발/검증 흐름을 제공한다."
    ],
    "non_goals": [
      "로컬 md/json 파일을 대체하지 않는다.",
      "P2A 하네스 또는 AI agent를 직접 실행하지 않는다.",
      "embedding 생성, RAG 응답 생성, 자동 개선 적용은 하지 않는다.",
      "서버 내장 웹 UI 또는 별도 브라우저 UI를 만들지 않는다.",
      "다중 사용자 권한, OAuth, cloud deployment, queue 기반 ingestion은 MVP 범위가 아니다.",
      "proposal 자동 적용은 MVP 범위가 아니며 후속 단계에서도 proposal 생성까지만 고려한다."
    ],
    "core_flows": [
      "클라이언트가 프로젝트를 등록하면 서버는 canonical projectId를 부여하고, 클라이언트가 보낸 로컬/P2A projectId는 sourceProjectId로 보존한다.",
      "클라이언트가 iteration을 등록하면 서버는 canonical iterationId를 부여하고, sourceIterationId와 canonical projectId를 연결한다.",
      "클라이언트가 sourcePath, artifactType, contentHash, raw content 또는 metadata를 포함한 문서 스냅샷을 저장한다.",
      "클라이언트가 task graph JSON과 graph 내 task 목록을 저장한다.",
      "클라이언트가 task별 run 기록과 산출물 참조를 저장한다.",
      "클라이언트가 문서 chunk와 선택적 embedding을 bulk 저장한다.",
      "클라이언트가 관계형 필터 또는 keyword/vector query로 산출물을 조회한다."
    ],
    "screens_or_interfaces": [
      "POST /api/projects: 프로젝트 등록 또는 upsert",
      "POST /api/projects/{projectId}/iterations: iteration 등록 또는 upsert",
      "POST /api/documents/snapshots: 문서/산출물 스냅샷 저장",
      "POST /api/task-graphs: task graph 저장",
      "POST /api/tasks/bulk: task 저장 또는 task graph에서 추출한 task upsert",
      "POST /api/runs: run 기록 저장",
      "POST /api/document-chunks/bulk: chunk와 선택적 embedding 저장",
      "GET /api/artifacts: canonical projectId, iterationId, taskId, runId, source*Id, artifactType, sourcePath 필터 조회",
      "GET /api/search/keyword: RAG 후보 검색용 keyword 검색. query q, limit, projectId, iterationId, artifactType, sourcePath, taskId, runId 필터를 받고, chunkId, documentId, projectId, iterationId, artifactType, sourcePath, chunkIndex, content, backend-specific score, matchReason, metadata를 반환한다.",
      "POST /api/search/vector: 외부 주입 query embedding 기반 vector 검색. 요청은 embeddingModel, embeddingDimension, embeddingVersion을 포함하고 같은 embedding set 안에서 검색한다.",
      "GET /actuator/health: 로컬 개발용 health check",
      "서버 내장 화면은 제공하지 않는다. status, diff, push, pull, conflict resolution, history 화면은 후속 P2A GUI/CLI 기능으로 제공한다."
    ],
    "data_model_draft": [
      "projects: projectId(canonical server UUID), sourceProjectId, name, rootPath, metadata, timestamps",
      "iterations: iterationId(canonical server UUID), sourceIterationId, projectId, label, status, metadata, timestamps",
      "documents: documentId(canonical server UUID), sourceDocumentId, projectId, iterationId, artifactType, sourcePath, contentHash, snapshotVersion, content, metadata, timestamps",
      "task_graphs: taskGraphId(canonical server UUID), sourceTaskGraphId, projectId, iterationId, sourceDocumentId, graphHash, graphJson, timestamps",
      "tasks: taskId(canonical server UUID), sourceTaskId, projectId, iterationId, taskGraphId, title, status, targetArea, dependenciesJson, acceptanceCriteriaJson, metadata",
      "runs: runId(canonical server UUID), sourceRunId, projectId, iterationId, taskId, status, agentTool, startedAt, finishedAt, runJson, artifactRefsJson",
      "document_chunks: chunkId(canonical server UUID), sourceChunkId, documentId, projectId, iterationId, taskId, runId, artifactType, sourcePath, chunkIndex, chunkHash, content, tokenEstimate, metadata",
      "embedding_sets: embeddingSetId(canonical server UUID), embeddingModel, embeddingDimension, embeddingVersion, distanceMetric, storageType, metadata, timestamps. unique key는 embeddingModel + embeddingDimension + embeddingVersion + distanceMetric이다.",
      "chunk_embeddings: chunkEmbeddingId(canonical server UUID), chunkId, embeddingSetId, embedding vector, embeddingHash(optional), metadata, timestamps. unique key는 chunkId + embeddingSetId다.",
      "content hash 중복 방지는 logical scope와 hash를 함께 사용한다. 같은 sourcePath/artifactType에 다른 hash가 들어오면 overwrite가 아니라 새 snapshotVersion을 만든다.",
      "서버 내부 관계, 검색, 회고, 자기고도화 metadata는 canonical server ID와 version lineage를 기준으로 삼고, source*Id와 sourcePath는 로컬 파일 세계로 되돌아가기 위한 reference로 사용한다.",
      "embedding은 document_chunks에 직접 저장하지 않고 embedding_sets와 chunk_embeddings로 분리한다. 모델 전환과 재색인을 위해 embeddingModel, embeddingDimension, embeddingVersion, distanceMetric으로 embedding set을 구분하고, vector 검색은 기본적으로 같은 embedding set 안에서만 수행한다."
    ],
    "external_integrations": [
      "PostgreSQL with pgvector: 관계형 저장과 vector 컬럼을 한 데이터베이스에 둔다. pgvector는 Postgres 클라이언트와 함께 사용할 수 있고 vector distance operator와 HNSW/IVFFlat 인덱스를 제공한다. [WEB-1]",
      "P2A CLI/GUI: 후속 공식 sync client다. git client처럼 local artifact working tree와 server canonical store의 status, diff, push, pull, conflict resolution, history를 제공하며, MVP 서버는 이를 위한 REST API와 metadata를 제공한다.",
      "Docker Compose: 로컬 PostgreSQL + pgvector 실행을 제공한다. Compose는 services, networks, volumes를 단일 YAML configuration file로 관리하고 단일 명령으로 시작할 수 있으므로 MVP의 로컬 DB 재현성에 사용한다. [WEB-11]",
      "Testcontainers: 통합 테스트에서 pgvector 이미지 기반 PostgreSQL을 실행한다. [WEB-3]",
      "OpenSearch/Elasticsearch: MVP 외부 연동은 아니며, 향후 KeywordSearchPort 또는 VectorSearchPort adapter 후보로만 고려한다. keyword 검색 API는 문서 검색 계약으로 정의해 후속 BM25 ranking, 한글 analyzer, phrase search, highlight/snippet, faceted filtering, recency boost, hybrid retrieval로 고도화할 수 있게 한다.",
      "AI API: 서버가 직접 호출하지 않는다."
    ],
    "success_criteria": [
      "Docker Compose로 pgvector가 활성화된 PostgreSQL을 띄우고 서버가 연결된다.",
      "프로젝트, iteration, document, task graph, task, run, chunk 저장 API가 idempotent하게 동작한다.",
      "동일 contentHash의 중복 저장이 추가 blob/chunk 중복을 만들지 않는다.",
      "요구된 필터 기준 조회가 가능하다.",
      "API 응답과 조회 결과가 canonical server ID와 로컬/P2A source ID를 함께 노출한다.",
      "서버 내장 웹 UI 없이도 P2A GUI/CLI가 sync 상태와 문서 history를 구현할 수 있는 hash, lineage, source reference metadata가 API에 포함된다.",
      "keyword 검색이 RAG/회고용 deterministic lexical retrieval로 동작한다. document_chunks.content를 주 대상으로 하고 documents.content, sourcePath, artifactType을 보조 대상으로 검색하며, 정확한 용어, 파일 경로, API path, 에러 문자열, 과거 결정 문구를 찾을 수 있다.",
      "외부에서 embedding과 embeddingModel/embeddingDimension/embeddingVersion을 주입하면 서버가 embedding set을 resolve/create하고 chunk_embeddings에 저장하며, vector 검색 API가 같은 embedding set의 chunk를 cosine exact search로 반환한다.",
      "application core가 Spring MVC, JDBC, PostgreSQL, pgvector 구현 세부에 직접 의존하지 않는다.",
      "Testcontainers 기반 통합 테스트가 migration, 저장, 조회, 검색, 중복 방지 경로를 검증한다."
    ],
    "constraints": [
      "로컬 파일이 원본이고 서버는 보조 저장소지만, 서버는 동기화된 artifact의 canonical ID, version lineage, 관계, 검색 index를 관리한다.",
      "서버는 headless REST service로 유지하고 화면과 동기화 UX는 P2A GUI/CLI가 담당한다.",
      "서버는 P2A 하네스와 AI agent를 실행하지 않는다.",
      "초기 단일 사용자 로컬 개발용이다.",
      "인증은 단순 API key 또는 local token이다.",
      "서버는 embedding을 생성하지 않고 외부 입력만 저장한다.",
      "자동 개선 적용은 하지 않는다.",
      "아키텍처는 pragmatic hexagonal로 설계하고, Spring Boot, PostgreSQL, pgvector, 인증 구현은 adapter로 격리한다.",
      "task graph 산출물은 approved spec을 기준으로 생성하거나 갱신한다.",
      "프로젝트 문서, REST contract, local development workflow 문서는 한글로 작성한다. API path, JSON field, class/package 이름은 구현 정확성을 위해 원문 표기를 유지한다."
    ]
  },
  "implementation": {
    "architecture": [
      "Kotlin + Spring Boot 4.1.0 stable 기반의 Spring WebMVC REST 애플리케이션 하나로 시작하되, 레이어드 아키텍처가 아니라 pragmatic hexagonal architecture로 구성한다. Java toolchain과 runtime baseline은 Java 25 LTS로 고정하고, Gradle은 Java 25 실행과 toolchain을 지원하는 9.1.0 이상 9.x를 기준으로 둔다. 빌드는 Gradle Kotlin DSL을 사용하며 루트 빌드 파일은 build.gradle.kts, 설정 파일은 settings.gradle.kts로 둔다. Spring Boot Gradle plugin은 Spring Boot runtime과 같은 stable 버전인 org.springframework.boot 4.1.0을 사용한다. 핵심 패키지는 domain, application/usecase, application/port/in, application/port/out, adapter/in/rest, adapter/out/postgres, adapter/out/search, adapter/out/security, config로 나눈다. [WEB-6] [WEB-7] [WEB-12] [WEB-14] [WEB-15] [WEB-16]",
      "서버는 headless REST service로 유지한다. 서버 내장 웹 UI, server-side rendered page, static frontend bundle은 만들지 않고, 화면과 sync UX는 P2A GUI/CLI가 담당한다.",
      "application core는 P2A 산출물 저장/검색 규칙만 알고 Spring MVC, JDBC, PostgreSQL, pgvector SQL, HTTP DTO에 직접 의존하지 않는다.",
      "domain model은 canonical server ID와 source reference를 분리한다. 서버 내부 관계와 lineage는 canonical ID를 기준으로 하고, 로컬/P2A ID와 sourcePath는 source reference로 보존한다.",
      "inbound port는 use case 단위로 둔다: RegisterProjectUseCase, RegisterIterationUseCase, SaveDocumentSnapshotUseCase, SaveTaskGraphUseCase, SaveTasksUseCase, SaveRunRecordUseCase, SaveDocumentChunksUseCase, FindArtifactsUseCase, KeywordSearchUseCase, VectorSearchUseCase.",